smartctl 7.3 2022-02-28 r5338 [x86_64-linux-6.1.0-17-amd64] (local build)
Copyright (C) 2002-22, Bruce Allen, Christian Franke, www.smartmontools.org

=== START OF READ SMART DATA SECTION ===
SMART Attributes Data Structure revision number: 16
Vendor Specific SMART Attributes with Thresholds:
ID# ATTRIBUTE_NAME          FLAG     VALUE WORST THRESH TYPE      UPDATED  WHEN_FAILED RAW_VALUE
  1 Raw_Read_Error_Rate     0x002f   100   100   050    Pre-fail  Always       -       0
  3 Spin_Up_Time            0x0027   100   100   001    Pre-fail  Always       -       2050
  4 Start_Stop_Count        0x0032   100   100   000    Old_age   Always       -       12
  5 Reallocated_Sector_Ct   0x0033   100   100   050    Pre-fail  Always       -       0
  7 Seek_Error_Rate         0x002e   100   100   050    Old_age   Always       -       0
  9 Power_On_Hours          0x0032   100   100   000    Old_age   Always       -       8721
 12 Power_Cycle_Count       0x0032   100   100   000    Old_age   Always       -       7
194 Temperature_Celsius     0x0022   100   100   000    Old_age   Always       -       42
197 Current_Pending_Sector  0x0032   100   100   000    Old_age   Always       -       0
198 Offline_Uncorrectable   0x0030   100   100   000    Old_age   Offline      -       0
